<?xml version="1.0" encoding="UTF-8" ?>

<menu
  xmlns:xsi="http://www.w3.org/2001/XMLSchema-instance"
  xsi:noNamespaceSchemaLocation="menu.xsd">
	
	<category name="Appetizers">
		<dish>
			<name>Insalata caprese</name>
			<ingredients>Pomodoro, mozzarella di bufala.</ingredients>
			<price>5</price> <!-- Prezzi in euro -->
		</dish>
		
		<dish>
			<name>Tartine al salmone</name>
			<ingredients>Pane, salmone fresco, uova di salmone.</ingredients>
			<price>8.50</price>
		</dish>
	</category>
	
	<category name="First dishes">
		<dish>
			<name>Bucatini alle sarde</name>
			<ingredients>Sarde fresche, acciuga, finocchietto selvatico, pinoli, cipolla, uvetta.</ingredients>
			<price>12.50</price>
		</dish>
		
		<dish>
			<name>Mezze maniche alla carbonara</name>
			<ingredients>Guanciale affumicato, pecorino romano, tuorlo d'uova bio da galline allevate a terra, pepe nero.</ingredients>
			<price>99.99</price>
		</dish>
	</category>
	
	<category name="Second dishes">
		<dish>
			<name>Filetto di pesce spada</name>
			<ingredients>Filetto di pesce spada fresco, aglio, prezzemolo, olio extravergine d'oliva.</ingredients>
			<price>13</price>
		</dish>
		
		<dish>
			<name>Filetto di salmone</name>
			<ingredients>Filetto di salmone fresco, aglio, prezzemolo, olio extravergine d'oliva.</ingredients>
			<price>15</price>
		</dish>
	</category>
	
	<category name="Desserts">
		<dish>
			<name>Macedonia di frutta</name>
			<ingredients>Ananas, fragole, pesca, melone bianco, cantalupo, kiwi, succo d'ananas.</ingredients>
			<price>4.50</price>
		</dish>
	</category>
	
	<category name="Bar">
		<dish>
			<name>Caff√® espresso</name>
			<price>1.50</price>
		</dish>
		
		<dish>
			<name>Cornetto Algida</name>
			<price>2.50</price>
		</dish>
	</category>
</menu>